package_name,ecosystem,cve_id,severity,cvss_score,description,published_date,affected_projects
pyYAML,pypi,GHSA-3pqx-4fqf-j49f,CVSS_V3,CVSS:3.1/AV:N/AC:L/PR:N/UI:N/S:U/C:H/I:H/A:H,Deserialization of Untrusted Data in PyYAML,2021-04-20T16:40:42Z,1
pyYAML,pypi,GHSA-6757-jp84-gxfx,CVSS_V3,CVSS:3.1/AV:N/AC:L/PR:N/UI:N/S:U/C:H/I:H/A:H,Improper Input Validation in PyYAML,2021-04-20T16:14:24Z,1
pyYAML,pypi,GHSA-8q59-q68h-6hv4,CVSS_V3,CVSS:3.1/AV:N/AC:L/PR:N/UI:N/S:U/C:H/I:H/A:H,Improper Input Validation in PyYAML,2021-03-25T21:26:26Z,1
pyYAML,pypi,GHSA-rprw-h62v-c2w7,CVSS_V3,CVSS:3.1/AV:N/AC:L/PR:N/UI:N/S:U/C:H/I:H/A:H,PyYAML insecurely deserializes YAML strings leading to arbitrary code execution,2019-01-04T17:45:26Z,1
pytorch-lightning,pypi,GHSA-r5qj-cvf9-p85h,CVSS_V3,CVSS:3.1/AV:N/AC:L/PR:N/UI:N/S:U/C:H/I:H/A:H,Code Injection in PyTorch Lightning,2022-03-06T00:00:16Z,1
ray,pypi,GHSA-6wgj-66m2-xxp2,CVSS_V3,CVSS:3.1/AV:N/AC:L/PR:N/UI:N/S:U/C:H/I:H/A:H,Ray has arbitrary code execution via jobs submission API,2023-11-28T09:30:26Z,1
ray,pypi,GHSA-h3xg-wv58-5p43,CVSS_V3,CVSS:3.1/AV:N/AC:L/PR:N/UI:N/S:U/C:H/I:H/A:H,Ray OS Command Injection vulnerability,2023-11-16T18:30:31Z,1
rope,pypi,GHSA-r38r-qp28-2m63,CVSS_V3,CVSS:3.1/AV:N/AC:L/PR:N/UI:N/S:U/C:H/I:H/A:H,Code injection in rope,2018-07-26T16:08:49Z,1
webpack,npm,GHSA-hc6q-2mpp-qw7j,CVSS_V3,CVSS:3.1/AV:N/AC:L/PR:N/UI:N/S:U/C:H/I:H/A:H,Cross-realm object access in Webpack 5,2023-03-13T03:30:15Z,1
org.apache.logging.log4j:log4j-core,maven,GHSA-p6xc-xr62-6r2g,CVSS_V3,CVSS:3.1/AV:N/AC:L/PR:N/UI:N/S:C/C:N/I:N/A:H,Apache Log4j2 vulnerable to Improper Input Validation and Uncontrolled Recursion,2021-12-18T18:00:07Z,1
aiohttp,pypi,GHSA-q3qx-c6g2-7pw2,CVSS_V3,CVSS:3.1/AV:N/AC:L/PR:N/UI:N/S:C/C:L/I:L/A:N,aiohttp's ClientSession is vulnerable to CRLF injection via version,2023-11-27T23:17:42Z,1
cairosvg,pypi,GHSA-rwmf-w63j-p7gv,CVSS_V3,CVSS:3.1/AV:N/AC:L/PR:N/UI:N/S:C/C:L/I:H/A:L,CairoSVG improperly processes SVG files loaded from external resources,2023-03-20T21:27:15Z,1
vite,npm,GHSA-mv48-hcvh-8jj8,CVSS_V3,CVSS:3.1/AV:N/AC:L/PR:N/UI:N/S:C/C:H/I:N/A:N,Vite before v2.9.13 vulnerable to directory traversal via crafted URL to victim's service,2022-08-19T00:00:20Z,1
org.apache.logging.log4j:log4j-core,maven,GHSA-jfh8-c2jp-5v3q,CVSS_V3,CVSS:3.1/AV:N/AC:L/PR:N/UI:N/S:C/C:H/I:H/A:H/E:H,Remote code injection in Log4j,2021-12-10T00:40:56Z,1
org.apache.commons:commons-configuration2,maven,GHSA-7qx4-pp76-vrqh,CVSS_V3,CVSS:3.1/AV:N/AC:L/PR:N/UI:N/S:C/C:H/I:H/A:H,Remote code execution in Apache Commons Configuration,2020-05-21T19:08:08Z,1
org.postgresql:postgresql,maven,GHSA-24rp-q3w6-vc56,CVSS_V3,CVSS:3.1/AV:N/AC:L/PR:N/UI:N/S:C/C:H/I:H/A:H,org.postgresql:postgresql vulnerable to SQL Injection via line comment generation,2024-02-21T23:33:43Z,1
jupyter-server,pypi,GHSA-64x5-55rw-9974,CVSS_V3,CVSS:3.1/AV:N/AC:L/PR:L/UI:R/S:U/C:L/I:L/A:N,cross-site inclusion (XSSI) of files in jupyter-server,2023-08-29T23:34:09Z,1
jupyter-server,pypi,GHSA-grfj-wjv9-4f9v,CVSS_V3,CVSS:3.1/AV:N/AC:L/PR:L/UI:R/S:C/C:N/I:L/A:N,Open redirect in Jupyter Server,2020-11-24T21:20:52Z,1
@angular/core,npm,GHSA-c75v-2vq8-878f,CVSS_V3,CVSS:3.1/AV:N/AC:L/PR:L/UI:R/S:C/C:L/I:L/A:N,Cross site scripting in Angular,2022-05-27T00:01:08Z,1
com.thoughtworks.xstream:xstream,maven,GHSA-6wf9-jmg9-vxcc,CVSS_V3,CVSS:3.1/AV:N/AC:L/PR:L/UI:N/S:U/C:N/I:N/A:H,XStream can cause a Denial of Service,2021-08-25T14:48:39Z,1
org.yaml:snakeyaml,maven,GHSA-98wm-3w3q-mw94,CVSS_V3,CVSS:3.1/AV:N/AC:L/PR:L/UI:N/S:U/C:N/I:N/A:H,snakeYAML before 1.31 vulnerable to Denial of Service due to Out-of-bounds Write,2022-09-06T00:00:27Z,1
org.yaml:snakeyaml,maven,GHSA-9w3m-gqgf-c4p9,CVSS_V3,CVSS:3.1/AV:N/AC:L/PR:L/UI:N/S:U/C:N/I:N/A:H,snakeYAML before 1.32 vulnerable to Denial of Service due to Out-of-bounds Write,2022-09-06T00:00:27Z,1
org.yaml:snakeyaml,maven,GHSA-c4r9-r8fh-9vj2,CVSS_V3,CVSS:3.1/AV:N/AC:L/PR:L/UI:N/S:U/C:N/I:N/A:H,snakeYAML before 1.31 vulnerable to Denial of Service due to Out-of-bounds Write,2022-09-06T00:00:27Z,1
pywin32,pypi,GHSA-hwfp-hg2m-9vr2,CVSS_V3,CVSS:3.1/AV:N/AC:L/PR:L/UI:N/S:U/C:N/I:N/A:H,Integer overflow in pywin32,2021-08-09T20:43:44Z,1
jupyter-server,pypi,GHSA-h56g-gq9v-vc8r,CVSS_V3,CVSS:3.1/AV:N/AC:L/PR:L/UI:N/S:U/C:L/I:N/A:N,jupyter-server errors include tracebacks with path information,2023-12-05T18:15:02Z,1
jupyter-server,pypi,PYSEC-2023-272,CVSS_V3,CVSS:3.1/AV:N/AC:L/PR:L/UI:N/S:U/C:L/I:N/A:N,"The Jupyter Server provides the backend (i.e. the core services, APIs, and REST endpoints) for Jupyter web applications like Jupyter notebook, JupyterLab, and Voila. Unhandled errors in API requests coming from an authenticated user include traceback information, which can include path information. There is no known mechanism by which to trigger these errors without authentication, so the paths revealed are not considered particularly sensitive, given that the requesting user has arbitrary execution permissions already in the same environment. A fix has been introduced in commit `0056c3aa52` which no longer includes traceback information in JSON error responses. For compatibility, the traceback field is present, but always empty. This commit has been included in version 2.11.2. Users are advised to upgrade. There are no known workarounds for this vulnerability.",2023-12-04T21:15:00Z,1
loguru,pypi,GHSA-39ph-wr67-j4xq,CVSS_V3,CVSS:3.1/AV:N/AC:L/PR:L/UI:N/S:U/C:L/I:N/A:N,loguru vulnerable to improper privilege management ,2022-01-26T00:01:50Z,1
tokio,crates,GHSA-7rrj-xr53-82p7,CVSS_V3,CVSS:3.1/AV:N/AC:L/PR:L/UI:N/S:U/C:L/I:N/A:L,Tokio reject_remote_clients configuration may get dropped when creating a Windows named pipe,2023-01-06T21:40:58Z,1
org.hibernate:hibernate-core,maven,GHSA-8grg-q944-cch5,CVSS_V3,CVSS:3.1/AV:N/AC:L/PR:L/UI:N/S:U/C:H/I:N/A:N,SQL Injection in Hibernate ORM,2022-02-10T23:05:04Z,1
paramiko,pypi,GHSA-wqmm-q65g-2hqr,CVSS_V3,CVSS:3.1/AV:N/AC:L/PR:L/UI:N/S:U/C:H/I:N/A:N,Paramiko Unsafe randomness usage may allow access to sensitive information,2022-05-01T23:28:57Z,1
streamlit,pypi,PYSEC-2024-153,CVSS_V3,CVSS:3.1/AV:N/AC:L/PR:L/UI:N/S:U/C:H/I:N/A:N,"Streamlit is a data oriented application development framework for python. Snowflake Streamlit open source addressed a security vulnerability via the static file sharing feature. Users of hosted Streamlit app(s) on Windows were vulnerable to a path traversal vulnerability when the static file sharing feature is enabled. An attacker could utilize the vulnerability to leak the password hash of the Windows user running Streamlit. The vulnerability was patched on Jul 25, 2024, as part of Streamlit open source version 1.37.0. The vulnerability only affects Windows.",2024-08-12T17:15:17Z,1
com.h2database:h2,maven,GHSA-7rpj-hg47-cx62,CVSS_V3,CVSS:3.1/AV:N/AC:L/PR:L/UI:N/S:U/C:H/I:N/A:H,Improper Restriction of XML External Entity Reference in com.h2database:h2.,2021-12-16T14:29:57Z,1
org.yaml:snakeyaml,maven,GHSA-mjmj-j48q-9wg2,CVSS_V3,CVSS:3.1/AV:N/AC:L/PR:L/UI:N/S:U/C:H/I:H/A:L,SnakeYaml Constructor Deserialization Remote Code Execution,2022-12-12T21:19:47Z,1
jupyter_core,pypi,GHSA-m678-f26j-3hrp,CVSS_V3,CVSS:3.1/AV:N/AC:L/PR:L/UI:N/S:U/C:H/I:H/A:H,Execution with Unnecessary Privileges in JupyterApp,2022-10-26T22:07:00Z,1
org.springframework.security:spring-security-web,maven,GHSA-gq28-h5vg-8prx,CVSS_V3,CVSS:3.1/AV:N/AC:L/PR:L/UI:N/S:U/C:H/I:H/A:H,Privilege escalation in spring security,2021-05-10T15:22:39Z,1
com.rabbitmq:amqp-client,maven,GHSA-mm8h-8587-p46h,CVSS_V3,CVSS:3.1/AV:N/AC:L/PR:H/UI:N/S:U/C:N/I:N/A:H,RabbitMQ Java client's Lack of Message Size Limitation leads to Remote DoS Attack,2023-10-24T01:49:09Z,1
sentry-sdk,pypi,GHSA-29pr-6jr8-q5jm,CVSS_V3,CVSS:3.1/AV:N/AC:L/PR:H/UI:N/S:C/C:H/I:L/A:N,Sentry SDK leaks sensitive session information when `sendDefaultPII` is set to `True`,2023-03-21T22:31:19Z,1
com.thoughtworks.xstream:xstream,maven,GHSA-56p8-3fh9-4cvq,CVSS_V3,CVSS:3.1/AV:N/AC:H/PR:N/UI:R/S:U/C:N/I:N/A:H,XStream is vulnerable to an attack using Regular Expression for a Denial of Service (ReDos),2021-03-22T23:29:09Z,1
aiohttp,pypi,GHSA-v6wp-4m6f-gcjg,CVSS_V3,CVSS:3.1/AV:N/AC:H/PR:N/UI:R/S:U/C:N/I:L/A:N,`aiohttp` Open Redirect vulnerability (`normalize_path_middleware` middleware),2021-02-26T02:11:57Z,1
com.thoughtworks.xstream:xstream,maven,GHSA-43gc-mjxg-gvrq,CVSS_V3,CVSS:3.1/AV:N/AC:H/PR:N/UI:R/S:U/C:N/I:H/A:N,XStream is vulnerable to an Arbitrary Code Execution attack,2021-03-22T23:29:28Z,1
com.thoughtworks.xstream:xstream,maven,GHSA-59jw-jqf4-3wq3,CVSS_V3,CVSS:3.1/AV:N/AC:H/PR:N/UI:R/S:U/C:N/I:H/A:N,XStream is vulnerable to an Arbitrary Code Execution attack,2021-03-22T23:28:23Z,1
com.thoughtworks.xstream:xstream,maven,GHSA-74cv-f58x-f9wf,CVSS_V3,CVSS:3.1/AV:N/AC:H/PR:N/UI:R/S:U/C:N/I:H/A:N,XStream is vulnerable to an Arbitrary File Deletion on the local host when unmarshalling as long as the executing process has sufficient rights,2021-03-22T23:28:13Z,1
com.thoughtworks.xstream:xstream,maven,GHSA-hvv8-336g-rx3m,CVSS_V3,CVSS:3.1/AV:N/AC:H/PR:N/UI:R/S:U/C:N/I:H/A:N,A Server-Side Forgery Request can be activated unmarshalling with XStream to access data streams from an arbitrary URL referencing a resource in an intranet or the local host,2021-03-22T23:28:01Z,1
hyper,crates,GHSA-f3pg-qwvg-p99c,CVSS_V3,CVSS:3.1/AV:N/AC:H/PR:N/UI:R/S:U/C:L/I:N/A:N,Lenient Parsing of Content-Length Header When Prefixed with Plus Sign,2021-07-12T16:54:20Z,1
nuxt,npm,GHSA-p6jq-8vc4-79f6,CVSS_V3,CVSS:3.1/AV:N/AC:H/PR:N/UI:R/S:U/C:L/I:N/A:N,Nuxt has Client-Side Path Traversal in Nuxt Island Payload Revival,2025-09-17T20:42:28Z,1
vite,npm,GHSA-4r4m-qw57-chr8,CVSS_V3,CVSS:3.1/AV:N/AC:H/PR:N/UI:R/S:U/C:H/I:N/A:N,Vite has a `server.fs.deny` bypassed for `inline` and `raw` with `?import` query,2025-03-31T17:31:54Z,1
vite,npm,GHSA-x574-m823-4x7w,CVSS_V3,CVSS:3.1/AV:N/AC:H/PR:N/UI:R/S:U/C:H/I:N/A:N,Vite bypasses server.fs.deny when using ?raw??,2025-03-25T14:00:02Z,1
vite,npm,GHSA-xcj6-pq6g-qj4x,CVSS_V3,CVSS:3.1/AV:N/AC:H/PR:N/UI:R/S:U/C:H/I:N/A:N,Vite allows server.fs.deny to be bypassed with .svg or relative paths,2025-04-04T14:20:05Z,1
webpack-dev-server,npm,GHSA-4v9v-hfq4-rm2v,CVSS_V3,CVSS:3.1/AV:N/AC:H/PR:N/UI:R/S:U/C:H/I:N/A:N,webpack-dev-server users' source code may be stolen when they access a malicious web site,2025-06-04T21:09:13Z,1
nltk,pypi,GHSA-cgvx-9447-vcch,CVSS_V3,CVSS:3.1/AV:N/AC:H/PR:N/UI:R/S:U/C:H/I:H/A:H,ntlk unsafe deserialization vulnerability,2024-06-28T00:33:31Z,1
werkzeug,pypi,GHSA-2g68-c3qc-8985,CVSS_V3,CVSS:3.1/AV:N/AC:H/PR:N/UI:R/S:U/C:H/I:H/A:H,Werkzeug debugger vulnerable to remote execution when interacting with attacker controlled domain,2024-05-06T14:21:27Z,1
com.thoughtworks.xstream:xstream,maven,GHSA-4hrm-m67v-5cxr,CVSS_V3,CVSS:3.1/AV:N/AC:H/PR:N/UI:R/S:C/C:N/I:H/A:N,XStream is vulnerable to an Arbitrary Code Execution attack,2021-03-22T23:28:49Z,1
com.thoughtworks.xstream:xstream,maven,GHSA-f6hm-88x3-mfjv,CVSS_V3,CVSS:3.1/AV:N/AC:H/PR:N/UI:R/S:C/C:N/I:H/A:N,A Server-Side Forgery Request can be activated unmarshalling with XStream to access data streams from an arbitrary URL referencing a resource in an intranet or the local host,2021-03-22T23:29:19Z,1
com.thoughtworks.xstream:xstream,maven,GHSA-qpfq-ph7r-qv6f,CVSS_V3,CVSS:3.1/AV:N/AC:H/PR:N/UI:R/S:C/C:N/I:H/A:N,XStream is vulnerable to an Arbitrary Code Execution attack,2021-03-22T23:29:00Z,1
aiohttp,pypi,GHSA-xx9p-xxvh-7g8j,CVSS_V3,CVSS:3.1/AV:N/AC:H/PR:N/UI:R/S:C/C:L/I:N/A:N,Aiohttp has inconsistent interpretation of `Content-Length` vs. `Transfer-Encoding` differing in C and Python fallbacks,2023-11-14T20:36:25Z,1
jquery,npm,GHSA-jpcq-cgw6-v4j6,CVSS_V3,CVSS:3.1/AV:N/AC:H/PR:N/UI:R/S:C/C:H/I:L/A:N/E:H,Potential XSS vulnerability in jQuery,2020-04-29T22:19:14Z,1
jquery,npm,GHSA-gxr4-xjj5-5px2,CVSS_V3,CVSS:3.1/AV:N/AC:H/PR:N/UI:R/S:C/C:H/I:L/A:N,Potential XSS vulnerability in jQuery,2020-04-29T22:18:55Z,1
configobj,pypi,GHSA-c33w-24p9-8m24,CVSS_V3,CVSS:3.1/AV:N/AC:H/PR:N/UI:N/S:U/C:N/I:N/A:L,configobj ReDoS exploitable by developer using values in a server-side configuration file,2023-04-03T06:30:19Z,1
golang.org/x/net,go,GHSA-h86h-8ppg-mxmh,CVSS_V3,CVSS:3.1/AV:N/AC:H/PR:N/UI:N/S:U/C:N/I:N/A:H,golang.org/x/net/http/httpguts vulnerable to Uncontrolled Recursion,2022-05-24T19:03:29Z,1
hyper,crates,GHSA-5h46-h7hh-c6x9,CVSS_V3,CVSS:3.1/AV:N/AC:H/PR:N/UI:N/S:U/C:N/I:N/A:H,Integer Overflow in Chunked Transfer-Encoding,2021-07-12T16:55:37Z,1
node-sass,npm,GHSA-9v62-24cr-58cx,CVSS_V3,CVSS:3.1/AV:N/AC:H/PR:N/UI:N/S:U/C:N/I:N/A:H,Denial of Service in node-sass,2020-09-11T21:12:39Z,1
opencv-contrib-python,pypi,GHSA-hxfw-jm98-v4mq,CVSS_V3,CVSS:3.1/AV:N/AC:H/PR:N/UI:N/S:U/C:N/I:N/A:H,Divide By Zero in OpenCV.,2021-10-12T22:21:56Z,1
tokio,crates,GHSA-2grh-hm3w-w7hv,CVSS_V3,CVSS:3.1/AV:N/AC:H/PR:N/UI:N/S:U/C:N/I:N/A:H,Race condition in tokio,2021-08-25T20:55:51Z,1
paramiko,pypi,GHSA-45x7-px36-x8w8,CVSS_V3,CVSS:3.1/AV:N/AC:H/PR:N/UI:N/S:U/C:N/I:H/A:N,Prefix Truncation Attack against ChaCha20-Poly1305 and Encrypt-then-MAC aka Terrapin,2023-12-18T19:22:09Z,1
org.apache.logging.log4j:log4j-core,maven,GHSA-vwqq-5vrc-xw9h,CVSS_V3,CVSS:3.1/AV:N/AC:H/PR:N/UI:N/S:U/C:L/I:N/A:N,Improper validation of certificate with host mismatch in Apache Log4j SMTP appender,2020-06-05T14:15:51Z,1
starlette,pypi,GHSA-v5gw-mw7f-84px,CVSS_V3,CVSS:3.1/AV:N/AC:H/PR:N/UI:N/S:U/C:L/I:N/A:N,Starlette has Path Traversal vulnerability in StaticFiles,2023-05-17T03:49:14Z,1
aiohttp,pypi,GHSA-jwhx-xcg6-8xhj,CVSS_V3,CVSS:3.1/AV:N/AC:H/PR:N/UI:N/S:U/C:L/I:L/A:N,"In aiohttp, compressed files as symlinks are not protected from path traversal",2024-08-09T16:49:58Z,1
commons-io:commons-io,maven,GHSA-gwrp-pvrq-jmwv,CVSS_V3,CVSS:3.1/AV:N/AC:H/PR:N/UI:N/S:U/C:L/I:L/A:N,Path Traversal and Improper Input Validation in Apache Commons IO,2021-04-26T16:04:00Z,1
hyper,crates,GHSA-6hfq-h8hq-87mf,CVSS_V3,CVSS:3.1/AV:N/AC:H/PR:N/UI:N/S:U/C:L/I:L/A:N,HTTP Request Smuggling in hyper,2021-08-25T20:56:18Z,1
aiohttp,pypi,GHSA-5h86-8mv2-jq9f,CVSS_V3,CVSS:3.1/AV:N/AC:H/PR:N/UI:N/S:U/C:H/I:N/A:N,aiohttp is vulnerable to directory traversal,2024-01-29T22:31:03Z,1
axios,npm,GHSA-4w2v-q235-vp99,CVSS_V3,CVSS:3.1/AV:N/AC:H/PR:N/UI:N/S:U/C:H/I:N/A:N,Axios vulnerable to Server-Side Request Forgery,2021-01-04T20:59:40Z,1
com.fasterxml.jackson.core:jackson-databind,maven,GHSA-mph4-vhrx-mv67,CVSS_V3,CVSS:3.1/AV:N/AC:H/PR:N/UI:N/S:U/C:H/I:N/A:N,Deserialization of Untrusted Data in FasterXML jackson-databind,2019-07-05T21:07:27Z,1
paramiko,pypi,GHSA-f8q4-jwww-x3wv,CVSS_V3,CVSS:3.1/AV:N/AC:H/PR:N/UI:N/S:U/C:H/I:N/A:N,Race Condition in Paramiko,2022-03-19T00:01:03Z,1
vite,npm,GHSA-8jhw-289h-jh2g,CVSS_V3,CVSS:3.1/AV:N/AC:H/PR:N/UI:N/S:U/C:H/I:N/A:N,Vite's `server.fs.deny` did not deny requests for patterns with directories.,2024-04-03T16:46:17Z,1
org.postgresql:postgresql,maven,GHSA-88cc-g835-76rp,CVSS_V3,CVSS:3.1/AV:N/AC:H/PR:N/UI:N/S:U/C:H/I:L/A:H,Improper Restriction of XML External Entity Reference,2022-02-10T00:30:07Z,1
PyJWT,pypi,GHSA-ffqj-6fqr-9h24,CVSS_V3,CVSS:3.1/AV:N/AC:H/PR:N/UI:N/S:U/C:H/I:H/A:N,Key confusion through non-blocklisted public key formats,2022-05-24T22:17:27Z,1
org.hibernate:hibernate-core,maven,GHSA-j8jw-g6fq-mp7h,CVSS_V3,CVSS:3.1/AV:N/AC:H/PR:N/UI:N/S:U/C:H/I:H/A:N,SQL injection in hibernate-core,2022-02-09T22:57:29Z,1
pydash,pypi,GHSA-8mjr-6c96-39w8,CVSS_V3,CVSS:3.1/AV:N/AC:H/PR:N/UI:N/S:U/C:H/I:H/A:N,pydash Command Injection vulnerability,2023-09-28T06:30:20Z,1
lightgbm,pypi,GHSA-2586-f3p4-hq84,CVSS_V3,CVSS:3.1/AV:N/AC:H/PR:N/UI:N/S:U/C:H/I:H/A:H/E:U/RL:O/RC:C,LightGBM Remote Code Execution Vulnerability,2024-11-12T18:30:58Z,1
com.fasterxml.jackson.core:jackson-databind,maven,GHSA-27xj-rqx5-2255,CVSS_V3,CVSS:3.1/AV:N/AC:H/PR:N/UI:N/S:U/C:H/I:H/A:H,jackson-databind mishandles the interaction between serialization gadgets and typing,2020-05-15T18:58:44Z,1
com.fasterxml.jackson.core:jackson-databind,maven,GHSA-5949-rw7g-wx7w,CVSS_V3,CVSS:3.1/AV:N/AC:H/PR:N/UI:N/S:U/C:H/I:H/A:H,Deserialization of untrusted data in jackson-databind,2021-01-20T21:20:15Z,1
com.fasterxml.jackson.core:jackson-databind,maven,GHSA-5r5r-6hpj-8gg9,CVSS_V3,CVSS:3.1/AV:N/AC:H/PR:N/UI:N/S:U/C:H/I:H/A:H,Serialization gadget exploit in jackson-databind,2021-12-09T19:15:24Z,1
com.fasterxml.jackson.core:jackson-databind,maven,GHSA-89qr-369f-5m5x,CVSS_V3,CVSS:3.1/AV:N/AC:H/PR:N/UI:N/S:U/C:H/I:H/A:H,Unsafe Deserialization in jackson-databind,2021-12-09T19:15:46Z,1
com.fasterxml.jackson.core:jackson-databind,maven,GHSA-8c4j-34r4-xr8g,CVSS_V3,CVSS:3.1/AV:N/AC:H/PR:N/UI:N/S:U/C:H/I:H/A:H,Unsafe Deserialization in jackson-databind,2021-12-09T19:16:18Z,1
com.fasterxml.jackson.core:jackson-databind,maven,GHSA-8w26-6f25-cm9x,CVSS_V3,CVSS:3.1/AV:N/AC:H/PR:N/UI:N/S:U/C:H/I:H/A:H,Unsafe Deserialization in jackson-databind,2021-12-09T19:16:02Z,1
com.fasterxml.jackson.core:jackson-databind,maven,GHSA-9gph-22xh-8x98,CVSS_V3,CVSS:3.1/AV:N/AC:H/PR:N/UI:N/S:U/C:H/I:H/A:H,Unsafe Deserialization in jackson-databind,2021-12-09T19:15:54Z,1
com.fasterxml.jackson.core:jackson-databind,maven,GHSA-9m6f-7xcq-8vf8,CVSS_V3,CVSS:3.1/AV:N/AC:H/PR:N/UI:N/S:U/C:H/I:H/A:H,Unsafe Deserialization in jackson-databind,2021-12-09T19:16:34Z,1
com.fasterxml.jackson.core:jackson-databind,maven,GHSA-c265-37vj-cwcc,CVSS_V3,CVSS:3.1/AV:N/AC:H/PR:N/UI:N/S:U/C:H/I:H/A:H,Deserialization of untrusted data in Jackson Databind,2020-06-18T14:44:48Z,1
com.fasterxml.jackson.core:jackson-databind,maven,GHSA-c2q3-4qrh-fm48,CVSS_V3,CVSS:3.1/AV:N/AC:H/PR:N/UI:N/S:U/C:H/I:H/A:H,Deserialization of untrusted data in Jackson Databind,2020-06-18T14:44:50Z,1
com.fasterxml.jackson.core:jackson-databind,maven,GHSA-cvm9-fjm9-3572,CVSS_V3,CVSS:3.1/AV:N/AC:H/PR:N/UI:N/S:U/C:H/I:H/A:H,Unsafe Deserialization in jackson-databind,2021-12-09T19:16:10Z,1
com.fasterxml.jackson.core:jackson-databind,maven,GHSA-f9xh-2qgp-cq57,CVSS_V3,CVSS:3.1/AV:N/AC:H/PR:N/UI:N/S:U/C:H/I:H/A:H,Unsafe Deserialization in jackson-databind,2021-12-09T19:16:42Z,1
com.fasterxml.jackson.core:jackson-databind,maven,GHSA-h3cw-g4mq-c5x2,CVSS_V3,CVSS:3.1/AV:N/AC:H/PR:N/UI:N/S:U/C:H/I:H/A:H,Code Injection in jackson-databind,2021-12-09T19:14:51Z,1
com.fasterxml.jackson.core:jackson-databind,maven,GHSA-h4rc-386g-6m85,CVSS_V3,CVSS:3.1/AV:N/AC:H/PR:N/UI:N/S:U/C:H/I:H/A:H,jackson-databind mishandles the interaction between serialization gadgets and typing,2020-04-23T20:19:02Z,1
com.fasterxml.jackson.core:jackson-databind,maven,GHSA-j823-4qch-3rgm,CVSS_V3,CVSS:3.1/AV:N/AC:H/PR:N/UI:N/S:U/C:H/I:H/A:H,Deserialization of untrusted data in Jackson Databind,2020-06-18T14:44:46Z,1
com.fasterxml.jackson.core:jackson-databind,maven,GHSA-m6x4-97wx-4q27,CVSS_V3,CVSS:3.1/AV:N/AC:H/PR:N/UI:N/S:U/C:H/I:H/A:H,Unsafe Deserialization in jackson-databind,2021-12-09T19:16:26Z,1
com.fasterxml.jackson.core:jackson-databind,maven,GHSA-mc6h-4qgp-37qh,CVSS_V3,CVSS:3.1/AV:N/AC:H/PR:N/UI:N/S:U/C:H/I:H/A:H,Deserialization of untrusted data in Jackson Databind,2020-06-18T14:44:43Z,1
com.fasterxml.jackson.core:jackson-databind,maven,GHSA-qjw2-hr98-qgfh,CVSS_V3,CVSS:3.1/AV:N/AC:H/PR:N/UI:N/S:U/C:H/I:H/A:H,Unsafe Deserialization in jackson-databind,2021-12-09T19:15:36Z,1
com.fasterxml.jackson.core:jackson-databind,maven,GHSA-r3gr-cxrf-hg25,CVSS_V3,CVSS:3.1/AV:N/AC:H/PR:N/UI:N/S:U/C:H/I:H/A:H,Serialization gadgets exploit in jackson-databind,2021-12-09T19:15:11Z,1
com.fasterxml.jackson.core:jackson-databind,maven,GHSA-r695-7vr9-jgc2,CVSS_V3,CVSS:3.1/AV:N/AC:H/PR:N/UI:N/S:U/C:H/I:H/A:H,Unsafe Deserialization in jackson-databind,2021-12-09T19:16:51Z,1
com.fasterxml.jackson.core:jackson-databind,maven,GHSA-rpr3-cw39-3pxh,CVSS_V3,CVSS:3.1/AV:N/AC:H/PR:N/UI:N/S:U/C:H/I:H/A:H,jackson-databind vulnerable to unsafe deserialization,2022-07-15T19:41:47Z,1
com.fasterxml.jackson.core:jackson-databind,maven,GHSA-v585-23hc-c647,CVSS_V3,CVSS:3.1/AV:N/AC:H/PR:N/UI:N/S:U/C:H/I:H/A:H,Unsafe Deserialization in jackson-databind,2021-11-19T20:13:06Z,1
com.fasterxml.jackson.core:jackson-databind,maven,GHSA-vfqx-33qm-g869,CVSS_V3,CVSS:3.1/AV:N/AC:H/PR:N/UI:N/S:U/C:H/I:H/A:H,Unsafe Deserialization in jackson-databind,2021-12-09T19:16:59Z,1
com.fasterxml.jackson.core:jackson-databind,maven,GHSA-w3f4-3q6j-rh82,CVSS_V3,CVSS:3.1/AV:N/AC:H/PR:N/UI:N/S:U/C:H/I:H/A:H,Deserialization of Untrusted Data in jackson-databind,2020-06-30T20:40:50Z,1
com.fasterxml.jackson.core:jackson-databind,maven,GHSA-wh8g-3j2c-rqj5,CVSS_V3,CVSS:3.1/AV:N/AC:H/PR:N/UI:N/S:U/C:H/I:H/A:H,Serialization gadgets exploit in jackson-databind,2021-12-09T19:15:00Z,1
cookiecutter,pypi,GHSA-f4q6-9qm4-h8j4,CVSS_V3,CVSS:3.1/AV:N/AC:H/PR:N/UI:N/S:U/C:H/I:H/A:H,OS Command Injection in cookiecutter,2022-06-09T23:48:49Z,1
hyper,crates,RUSTSEC-2021-0020,CVSS_V3,CVSS:3.1/AV:N/AC:H/PR:N/UI:N/S:U/C:H/I:H/A:H,Multiple Transfer-Encoding headers misinterprets request payload,2021-02-05T12:00:00Z,1
lightgbm,pypi,PYSEC-2024-231,CVSS_V3,CVSS:3.1/AV:N/AC:H/PR:N/UI:N/S:U/C:H/I:H/A:H,LightGBM Remote Code Execution Vulnerability,2024-11-12T18:15:28Z,1
pyOpenSSL,pypi,GHSA-p28m-34f6-967q,CVSS_V3,CVSS:3.1/AV:N/AC:H/PR:N/UI:N/S:U/C:H/I:H/A:H,PyOpenSSL Use-After-Free vulnerability,2018-10-10T16:10:38Z,1
tokio,crates,GHSA-fg7r-2g4j-5cgr,CVSS_V3,CVSS:3.1/AV:N/AC:H/PR:N/UI:N/S:U/C:H/I:H/A:H,Race Condition in tokio,2022-01-06T22:04:37Z,1
com.thoughtworks.xstream:xstream,maven,GHSA-jfvx-7wrx-43fh,CVSS_V3,CVSS:3.1/AV:N/AC:H/PR:N/UI:N/S:C/C:N/I:H/A:N,XStream vulnerable to an Arbitrary File Deletion on the local host when unmarshalling,2020-12-21T16:28:26Z,1
httplib2,pypi,GHSA-gg84-qgv9-w4pq,CVSS_V3,CVSS:3.1/AV:N/AC:H/PR:N/UI:N/S:C/C:N/I:H/A:N,CRLF injection in httplib2,2020-05-20T15:55:47Z,1
handlebars,npm,GHSA-3cqr-58rm-57f8,CVSS_V3,CVSS:3.1/AV:N/AC:H/PR:N/UI:N/S:C/C:H/I:L/A:L,Arbitrary Code Execution in Handlebars,2022-02-10T20:38:19Z,1
org.apache.logging.log4j:log4j-core,maven,GHSA-7rjr-3q55-vv33,CVSS_V3,CVSS:3.1/AV:N/AC:H/PR:N/UI:N/S:C/C:H/I:H/A:H/E:H,Incomplete fix for Apache Log4j vulnerability,2021-12-14T18:01:28Z,1
jupyter-server,pypi,GHSA-q874-g24w-4q9g,CVSS_V3,CVSS:3.1/AV:N/AC:H/PR:L/UI:R/S:U/C:H/I:H/A:H,Jupyter server Token bruteforcing,2022-06-16T23:13:57Z,1
org.postgresql:postgresql,maven,GHSA-r38f-c4h4-hqq2,CVSS_V3,CVSS:3.1/AV:N/AC:H/PR:L/UI:R/S:U/C:H/I:H/A:H,PostgreSQL JDBC Driver SQL Injection in ResultSet.refreshRow() with malicious column names,2022-08-06T05:51:38Z,1
com.thoughtworks.xstream:xstream,maven,GHSA-hwpc-8xqv-jvj4,CVSS_V3,CVSS:3.1/AV:N/AC:H/PR:L/UI:R/S:C/C:N/I:H/A:N,XStream is vulnerable to a Remote Command Execution attack,2021-03-22T23:28:38Z,1
dash-core-components,pypi,GHSA-547x-748v-vp6p,CVSS_V3,CVSS:3.1/AV:N/AC:H/PR:L/UI:R/S:C/C:H/I:L/A:N,Dash apps vulnerable to Cross-site Scripting,2024-02-02T06:30:31Z,1
dash-html-components,pypi,GHSA-547x-748v-vp6p,CVSS_V3,CVSS:3.1/AV:N/AC:H/PR:L/UI:R/S:C/C:H/I:L/A:N,Dash apps vulnerable to Cross-site Scripting,2024-02-02T06:30:31Z,1
com.thoughtworks.xstream:xstream,maven,GHSA-mw36-7c6c-q4q2,CVSS_V3,CVSS:3.1/AV:N/AC:H/PR:L/UI:R/S:C/C:H/I:H/A:H,XStream can be used for Remote Code Execution,2020-11-16T20:07:59Z,1
formidable,npm,GHSA-75v8-2h7p-7m2m,CVSS_V3,CVSS:3.1/AV:N/AC:H/PR:L/UI:N/S:U/C:N/I:L/A:N,Formidable relies on hexoid to prevent guessing of filenames for untrusted executable content,2025-04-26T21:31:26Z,1
rollup,npm,GHSA-gcx4-mw62-g8wm,CVSS_V3,CVSS:3.1/AV:N/AC:H/PR:L/UI:N/S:U/C:L/I:L/A:H,DOM Clobbering Gadget found in rollup bundled scripts that leads to XSS,2024-09-23T22:11:02Z,1
vite,npm,GHSA-64vr-g452-qvp3,CVSS_V3,CVSS:3.1/AV:N/AC:H/PR:L/UI:N/S:U/C:L/I:L/A:H,Vite DOM Clobbering gadget found in vite bundled scripts that leads to XSS,2024-09-17T19:28:01Z,1
webpack,npm,GHSA-4vvj-4cpr-p986,CVSS_V3,CVSS:3.1/AV:N/AC:H/PR:L/UI:N/S:U/C:L/I:L/A:H,Webpack's AutoPublicPathRuntimeModule has a DOM Clobbering Gadget that leads to XSS,2024-08-27T19:50:40Z,1
celery,pypi,GHSA-q4xr-rc97-m4xx,CVSS_V3,CVSS:3.1/AV:N/AC:H/PR:L/UI:N/S:U/C:H/I:H/A:H,OS Command Injection in celery,2022-01-06T22:22:02Z,1
com.thoughtworks.xstream:xstream,maven,GHSA-7chv-rrw6-w6fc,CVSS_V3,CVSS:3.1/AV:N/AC:H/PR:L/UI:N/S:U/C:H/I:H/A:H,XStream is vulnerable to a Remote Command Execution attack,2021-05-18T18:36:27Z,1
com.thoughtworks.xstream:xstream,maven,GHSA-4cch-wxpw-8p28,CVSS_V3,CVSS:3.1/AV:N/AC:H/PR:L/UI:N/S:C/C:H/I:N/A:N,Server-Side Forgery Request can be activated unmarshalling with XStream,2020-12-21T16:28:42Z,1
com.thoughtworks.xstream:xstream,maven,GHSA-j9h8-phrw-h4fh,CVSS_V3,CVSS:3.1/AV:N/AC:H/PR:L/UI:N/S:C/C:H/I:H/A:H/E:H,XStream is vulnerable to a Remote Command Execution attack,2021-08-25T14:48:19Z,1
com.thoughtworks.xstream:xstream,maven,GHSA-2q8x-2p7f-574v,CVSS_V3,CVSS:3.1/AV:N/AC:H/PR:L/UI:N/S:C/C:H/I:H/A:H,XStream is vulnerable to an Arbitrary Code Execution attack,2021-08-25T14:46:49Z,1
com.thoughtworks.xstream:xstream,maven,GHSA-3ccq-5vw3-2p6x,CVSS_V3,CVSS:3.1/AV:N/AC:H/PR:L/UI:N/S:C/C:H/I:H/A:H,XStream is vulnerable to an Arbitrary Code Execution attack,2021-08-25T14:47:28Z,1
com.thoughtworks.xstream:xstream,maven,GHSA-64xx-cq4q-mf44,CVSS_V3,CVSS:3.1/AV:N/AC:H/PR:L/UI:N/S:C/C:H/I:H/A:H,XStream is vulnerable to an Arbitrary Code Execution attack,2021-08-25T14:48:47Z,1
com.thoughtworks.xstream:xstream,maven,GHSA-6w62-hx7r-mw68,CVSS_V3,CVSS:3.1/AV:N/AC:H/PR:L/UI:N/S:C/C:H/I:H/A:H,XStream is vulnerable to an Arbitrary Code Execution attack,2021-08-25T14:46:38Z,1
com.thoughtworks.xstream:xstream,maven,GHSA-8jrj-525p-826v,CVSS_V3,CVSS:3.1/AV:N/AC:H/PR:L/UI:N/S:C/C:H/I:H/A:H,XStream is vulnerable to an Arbitrary Code Execution attack,2021-08-25T14:48:12Z,1
