package_name,ecosystem,cve_id,severity,cvss_score,description,published_date,affected_projects
glob-parent,npm,GHSA-ww39-953v-wcq6,CVSS_V3,CVSS:3.1/AV:N/AC:L/PR:N/UI:N/S:U/C:N/I:N/A:H,glob-parent vulnerable to Regular Expression Denial of Service in enclosure regex,2021-06-07T21:56:34Z,0
ws,npm,GHSA-3h5v-q93c-6h6q,CVSS_V3,CVSS:3.1/AV:N/AC:L/PR:N/UI:N/S:U/C:N/I:N/A:H,ws affected by a DoS when handling a request with many HTTP headers,2024-06-17T19:09:10Z,0
ws,npm,GHSA-5v72-xg48-5rpm,CVSS_V3,CVSS:3.1/AV:N/AC:L/PR:N/UI:N/S:U/C:N/I:N/A:H,Denial of Service in ws,2019-06-04T19:37:52Z,0
yaml,npm,GHSA-f9xv-q969-pqx4,CVSS_V3,CVSS:3.1/AV:N/AC:L/PR:N/UI:N/S:U/C:N/I:N/A:H,Uncaught Exception in yaml,2023-04-24T15:30:34Z,0
braces,npm,GHSA-grv7-fg5c-xmjg,CVSS_V3,CVSS:3.1/AV:N/AC:L/PR:N/UI:N/S:U/C:N/I:N/A:H,Uncontrolled resource consumption in braces,2024-05-14T18:30:54Z,0
qs,npm,GHSA-hrpp-h998-j3pp,CVSS_V3,CVSS:3.1/AV:N/AC:L/PR:N/UI:N/S:U/C:N/I:N/A:H,qs vulnerable to Prototype Pollution,2022-11-27T00:30:50Z,0
path-to-regexp,npm,GHSA-9wv6-86v2-598j,CVSS_V3,CVSS:3.1/AV:N/AC:L/PR:N/UI:N/S:U/C:N/I:N/A:H,path-to-regexp outputs backtracking regular expressions,2024-09-09T20:19:15Z,0
path-to-regexp,npm,GHSA-rhx6-c78j-4q9w,CVSS_V3,CVSS:3.1/AV:N/AC:L/PR:N/UI:N/S:U/C:N/I:N/A:H,path-to-regexp contains a ReDoS,2024-12-05T22:40:47Z,0
colors,npm,GHSA-gh88-3pxp-6fm8,CVSS_V3,CVSS:3.1/AV:N/AC:L/PR:N/UI:N/S:U/C:N/I:N/A:H,Infinite Loop in colors.js,2022-01-21T23:39:50Z,0
cross-spawn,npm,GHSA-3xgq-45jj-v275,CVSS_V3,CVSS:3.1/AV:N/AC:L/PR:N/UI:N/S:U/C:N/I:N/A:H,Regular Expression Denial of Service (ReDoS) in cross-spawn,2024-11-08T06:30:47Z,0
Twisted,pypi,GHSA-rv6r-3f5q-9rgx,CVSS_V3,CVSS:3.1/AV:N/AC:L/PR:N/UI:N/S:U/C:N/I:N/A:H,Twisted SSH client and server deny of service during SSH handshake.,2022-03-03T19:02:08Z,0
cbor2,pypi,GHSA-375g-39jq-vq7m,CVSS_V3,CVSS:3.1/AV:N/AC:L/PR:N/UI:N/S:U/C:N/I:N/A:H,Potential buffer overflow in CBOR2 decoder,2024-02-21T00:09:03Z,0
cbor2,pypi,PYSEC-2024-155,CVSS_V3,CVSS:3.1/AV:N/AC:L/PR:N/UI:N/S:U/C:N/I:N/A:H,"cbor2 provides encoding and decoding for the Concise Binary Object Representation (CBOR) (RFC 8949) serialization format. Starting in version 5.5.1 and prior to version 5.6.2, an attacker can crash a service using cbor2 to parse a CBOR binary by sending a long enough object. Version 5.6.2 contains a patch for this issue.",2024-02-19T23:15:07Z,0
twisted,pypi,GHSA-3gqj-cmxr-p4x2,CVSS_V3,CVSS:3.1/AV:N/AC:L/PR:N/UI:N/S:U/C:N/I:L/A:N,Forced Browsing in Twisted,2021-04-30T17:32:28Z,0
twisted,pypi,GHSA-xc8x-vp79-p3wm,CVSS_V3,CVSS:3.1/AV:N/AC:L/PR:N/UI:N/S:U/C:N/I:L/A:N,twisted.web has disordered HTTP pipeline response,2023-10-25T21:15:13Z,0
twisted,pypi,PYSEC-2023-224,CVSS_V3,CVSS:3.1/AV:N/AC:L/PR:N/UI:N/S:U/C:N/I:L/A:N,"Twisted is an event-based framework for internet applications. Prior to version 23.10.0rc1, when sending multiple HTTP requests in one TCP packet, twisted.web will process the requests asynchronously without guaranteeing the response order. If one of the endpoints is controlled by an attacker, the attacker can delay the response on purpose to manipulate the response of the second request when a victim launched two requests using HTTP pipeline. Version 23.10.0rc1 contains a patch for this issue.",2023-10-25T21:15:00Z,0
django,pypi,GHSA-7qfw-j7hp-v45g,CVSS_V3,CVSS:3.1/AV:N/AC:L/PR:N/UI:N/S:U/C:N/I:L/A:N,Django WSGI Header Spoofing Vulnerability,2022-05-17T03:20:54Z,0
django,pypi,GHSA-fvgf-6h6h-3322,CVSS_V3,CVSS:3.1/AV:N/AC:L/PR:N/UI:N/S:U/C:N/I:L/A:N,Django Directory Traversal via archive.extract,2021-03-18T20:29:49Z,0
node-forge,npm,GHSA-2r2c-g63r-vccr,CVSS_V3,CVSS:3.1/AV:N/AC:L/PR:N/UI:N/S:U/C:N/I:L/A:N,Improper Verification of Cryptographic Signature in `node-forge`,2022-03-18T23:10:48Z,0
Twisted,pypi,GHSA-3gqj-cmxr-p4x2,CVSS_V3,CVSS:3.1/AV:N/AC:L/PR:N/UI:N/S:U/C:N/I:L/A:N,Forced Browsing in Twisted,2021-04-30T17:32:28Z,0
Twisted,pypi,GHSA-xc8x-vp79-p3wm,CVSS_V3,CVSS:3.1/AV:N/AC:L/PR:N/UI:N/S:U/C:N/I:L/A:N,twisted.web has disordered HTTP pipeline response,2023-10-25T21:15:13Z,0
Twisted,pypi,PYSEC-2023-224,CVSS_V3,CVSS:3.1/AV:N/AC:L/PR:N/UI:N/S:U/C:N/I:L/A:N,"Twisted is an event-based framework for internet applications. Prior to version 23.10.0rc1, when sending multiple HTTP requests in one TCP packet, twisted.web will process the requests asynchronously without guaranteeing the response order. If one of the endpoints is controlled by an attacker, the attacker can delay the response on purpose to manipulate the response of the second request when a victim launched two requests using HTTP pipeline. Version 23.10.0rc1 contains a patch for this issue.",2023-10-25T21:15:00Z,0
brotli,pypi,GHSA-5v8v-66v8-mwm7,CVSS_V3,CVSS:3.1/AV:N/AC:L/PR:N/UI:N/S:U/C:N/I:L/A:L,Integer overflow in the bundled Brotli C library,2022-05-24T17:28:21Z,0
Brotli,pypi,GHSA-5v8v-66v8-mwm7,CVSS_V3,CVSS:3.1/AV:N/AC:L/PR:N/UI:N/S:U/C:N/I:L/A:L,Integer overflow in the bundled Brotli C library,2022-05-24T17:28:21Z,0
websocket-extensions,npm,GHSA-g78m-2chm-r7qv,CVSS_V3,CVSS:3.1/AV:N/AC:L/PR:N/UI:N/S:U/C:N/I:L/A:H,Regular Expression Denial of Service in websocket-extensions (NPM package),2020-06-05T16:16:12Z,0
waitress,pypi,GHSA-4f7p-27jc-3c36,CVSS_V3,CVSS:3.1/AV:N/AC:L/PR:N/UI:N/S:U/C:N/I:H/A:N,HTTP Request Smuggling in waitress,2022-03-18T19:00:59Z,0
waitress,pypi,GHSA-j7j6-7hfx-5522,CVSS_V3,CVSS:3.1/AV:N/AC:L/PR:N/UI:N/S:U/C:N/I:H/A:N,Inconsistent Interpretation of HTTP Requests in Waitress,2022-05-24T17:07:06Z,0
twisted,pypi,GHSA-3c45-wgjp-7v9r,CVSS_V3,CVSS:3.1/AV:N/AC:L/PR:N/UI:N/S:U/C:N/I:H/A:N,Python Twisted trustRoot is not respected in HTTP client,2019-12-17T22:52:34Z,0
pyopenssl,pypi,GHSA-6748-36qp-fx6r,CVSS_V3,CVSS:3.1/AV:N/AC:L/PR:N/UI:N/S:U/C:N/I:H/A:N,PyOpenSSL Mishandles NUL Byte In Certificate Subject Alternative Name,2022-05-17T04:56:46Z,0
transifex-client,pypi,GHSA-jf99-2rj4-jxrm,CVSS_V3,CVSS:3.1/AV:N/AC:L/PR:N/UI:N/S:U/C:N/I:H/A:N,Transifex command-line client has improper certificate validation,2022-05-17T04:45:17Z,0
django,pypi,GHSA-2655-q453-22f9,CVSS_V3,CVSS:3.1/AV:N/AC:L/PR:N/UI:N/S:U/C:N/I:H/A:N,Django Allows Arbitrary URL Generation,2022-05-17T05:10:31Z,0
django,pypi,GHSA-5j2h-h5hg-3wf8,CVSS_V3,CVSS:3.1/AV:N/AC:L/PR:N/UI:N/S:U/C:N/I:H/A:N,Cross-site request forgery in Django,2018-07-23T19:51:10Z,0
django,pypi,GHSA-6wgp-fwfm-mxp3,CVSS_V3,CVSS:3.1/AV:N/AC:L/PR:N/UI:N/S:U/C:N/I:H/A:N,Django allows user sessions hijacking via an empty string in the session key,2022-05-17T03:29:56Z,0
django,pypi,GHSA-f7cm-ccfp-3q4r,CVSS_V3,CVSS:3.1/AV:N/AC:L/PR:N/UI:N/S:U/C:N/I:H/A:N,Django Incorrectly Validates URLs,2022-05-14T02:09:22Z,0
django,pypi,GHSA-h95j-h2rv-qrg4,CVSS_V3,CVSS:3.1/AV:N/AC:L/PR:N/UI:N/S:U/C:N/I:H/A:N,Django Cross-Site Request Forgery vulnerability,2018-07-23T19:51:19Z,0
django,pypi,GHSA-p99v-5w3c-jqq9,CVSS_V3,CVSS:3.1/AV:N/AC:L/PR:N/UI:N/S:U/C:N/I:H/A:N,"Django Access Control Bypass possibly leading to SSRF, RFI, and LFI attacks ",2021-06-10T17:21:12Z,0
django,pypi,GHSA-q5qw-4364-5hhm,CVSS_V3,CVSS:3.1/AV:N/AC:L/PR:N/UI:N/S:U/C:N/I:H/A:N,Django Vulnerable to HTTP Response Splitting Attack,2022-05-17T00:48:30Z,0
django,pypi,GHSA-r5cj-wv24-92p5,CVSS_V3,CVSS:3.1/AV:N/AC:L/PR:N/UI:N/S:U/C:N/I:H/A:N,Django cross-site request forgery (CSRF) vulnerability,2022-05-02T00:05:00Z,0
django,pypi,GHSA-rm2j-x595-q9cj,CVSS_V3,CVSS:3.1/AV:N/AC:L/PR:N/UI:N/S:U/C:N/I:H/A:N,Django Vulnerable to Cache Poisoning,2022-05-14T03:49:36Z,0
django,pypi,GHSA-vq3h-3q7v-9prw,CVSS_V3,CVSS:3.1/AV:N/AC:L/PR:N/UI:N/S:U/C:N/I:H/A:N,Django Allows Open Redirects,2022-05-14T02:09:43Z,0
django,pypi,GHSA-wxg3-mfph-qg9w,CVSS_V3,CVSS:3.1/AV:N/AC:L/PR:N/UI:N/S:U/C:N/I:H/A:N,Django Might Allow CSRF Requests via URL Verification,2022-05-14T03:49:36Z,0
node-forge,npm,GHSA-cfm4-qjh2-4765,CVSS_V3,CVSS:3.1/AV:N/AC:L/PR:N/UI:N/S:U/C:N/I:H/A:N,Improper Verification of Cryptographic Signature in node-forge,2022-03-18T23:09:54Z,0
node-forge,npm,GHSA-x4jg-mjrx-434g,CVSS_V3,CVSS:3.1/AV:N/AC:L/PR:N/UI:N/S:U/C:N/I:H/A:N,Improper Verification of Cryptographic Signature in node-forge,2022-03-18T23:10:28Z,0
Twisted,pypi,GHSA-3c45-wgjp-7v9r,CVSS_V3,CVSS:3.1/AV:N/AC:L/PR:N/UI:N/S:U/C:N/I:H/A:N,Python Twisted trustRoot is not respected in HTTP client,2019-12-17T22:52:34Z,0
paddlepaddle,pypi,GHSA-2rp8-hff9-c5wr,CVSS_V3,CVSS:3.1/AV:N/AC:L/PR:N/UI:N/S:U/C:N/I:H/A:H,PaddlePaddle Path Traversal vulnerability,2024-03-07T15:30:38Z,0
onnx,pypi,PYSEC-2025-10,CVSS_V3,CVSS:3.1/AV:N/AC:L/PR:N/UI:N/S:U/C:N/I:H/A:H,"A vulnerability in the `download_model` function of the onnx/onnx framework, before and including version 1.16.1, allows for arbitrary file overwrite due to inadequate prevention of path traversal attacks in malicious tar files. This vulnerability can be exploited by an attacker to overwrite files in the user's directory, potentially leading to remote command execution.",2025-03-20T10:15:37Z,0
opencv-python-headless,pypi,GHSA-x3rm-644h-67m8,CVSS_V3,CVSS:3.1/AV:N/AC:L/PR:N/UI:N/S:U/C:L/I:N/A:N,Out-of-bounds Read in OpenCV,2021-10-12T22:22:05Z,0
django,pypi,GHSA-jrh2-hc4r-7jwx,CVSS_V3,CVSS:3.1/AV:N/AC:L/PR:N/UI:N/S:U/C:L/I:N/A:N,Directory-traversal in Django,2022-01-12T19:21:04Z,0
django,pypi,GHSA-rw75-m7gp-92m3,CVSS_V3,CVSS:3.1/AV:N/AC:L/PR:N/UI:N/S:U/C:L/I:N/A:N,Django data leakage via querystring manipulation in admin,2022-05-14T02:09:22Z,0
django,pypi,GHSA-x7q2-wr7g-xqmf,CVSS_V3,CVSS:3.1/AV:N/AC:L/PR:N/UI:N/S:U/C:L/I:N/A:N,Django vulnerable to user enumeration attack,2024-07-10T06:33:52Z,0
django,pypi,GHSA-xgxc-v2qg-chmh,CVSS_V3,CVSS:3.1/AV:N/AC:L/PR:N/UI:N/S:U/C:L/I:N/A:N,Directory Traversal in Django,2021-04-08T18:11:48Z,0
gitpython,pypi,PYSEC-2023-165,CVSS_V3,CVSS:3.1/AV:N/AC:L/PR:N/UI:N/S:U/C:L/I:N/A:L," GitPython is a python library used to interact with Git repositories. In order to resolve some git references, GitPython reads files from the `.git` directory, in some places the name of the file being read is provided by the user, GitPython doesn't check if this file is located outside the `.git` directory. This allows an attacker to make GitPython read any file from the system. This vulnerability is present in https://github.com/gitpython-developers/GitPython/blob/1c8310d7cae144f74a671cbe17e51f63a830adbf/git/refs/symbolic.py#L174-L175. That code joins the base directory with a user given string without checking if the final path is located outside the base directory. This vulnerability cannot be used to read the contents of files but could in theory be used to trigger a denial of service for the program. This issue has not yet been addressed.",2023-08-30T22:15:00Z,0
opencv-python-headless,pypi,GHSA-jggw-2q6g-c3m6,CVSS_V3,CVSS:3.1/AV:N/AC:L/PR:N/UI:N/S:U/C:L/I:N/A:L,Out-of-bounds Read in OpenCV,2021-10-12T22:22:58Z,0
django,pypi,GHSA-v6rh-hp5x-86rv,CVSS_V3,CVSS:3.1/AV:N/AC:L/PR:N/UI:N/S:U/C:L/I:L/A:L,Potential bypass of an upstream access control based on URL paths in Django,2021-12-09T19:09:37Z,0
y18n,npm,GHSA-c4w7-xm78-47vh,CVSS_V3,CVSS:3.1/AV:N/AC:L/PR:N/UI:N/S:U/C:L/I:L/A:L,Prototype Pollution in y18n,2021-03-29T16:05:12Z,0
paddlepaddle,pypi,GHSA-jwrc-3v3f-5cq5,CVSS_V3,CVSS:3.1/AV:N/AC:L/PR:N/UI:N/S:U/C:H/I:N/A:N,PaddlePaddle allows arbitrary file read via paddle.vision.ops.read_file,2024-03-23T21:30:39Z,0
twisted,pypi,GHSA-92x2-jw7w-xvvx,CVSS_V3,CVSS:3.1/AV:N/AC:L/PR:N/UI:N/S:U/C:H/I:N/A:N,Cookie and header exposure in twisted,2022-02-07T22:36:00Z,0
vllm,pypi,GHSA-wr9h-g72x-mwhm,CVSS_V3,CVSS:3.1/AV:N/AC:L/PR:N/UI:N/S:U/C:H/I:N/A:N,vLLM is vulnerable to timing attack at bearer auth,2025-10-07T17:24:47Z,0
onnx,pypi,GHSA-ffxj-547x-5j7c,CVSS_V3,CVSS:3.1/AV:N/AC:L/PR:N/UI:N/S:U/C:H/I:N/A:N,Directory Traversal in onnx,2023-01-26T21:30:25Z,0
onnx,pypi,GHSA-whh8-fjgc-qp73,CVSS_V3,CVSS:3.1/AV:N/AC:L/PR:N/UI:N/S:U/C:H/I:N/A:N,Onnx Directory Traversal vulnerability,2024-02-23T18:30:59Z,0
onnx,pypi,PYSEC-2024-222,CVSS_V3,CVSS:3.1/AV:N/AC:L/PR:N/UI:N/S:U/C:H/I:N/A:N,"Versions of the package onnx before and including 1.15.0 are vulnerable to Directory Traversal as the external_data field of the tensor proto can have a path to the file which is outside the model current directory or user-provided directory. The vulnerability occurs as a bypass for the patch added for CVE-2022-25882.
",2024-02-23T18:15:50Z,0
mkdocs,pypi,GHSA-qh9q-34h6-hcv9,CVSS_V3,CVSS:3.1/AV:N/AC:L/PR:N/UI:N/S:U/C:H/I:N/A:N,Directory traversal in mkdocs,2021-10-12T18:48:24Z,0
mkdocs,pypi,PYSEC-2021-878,CVSS_V3,CVSS:3.1/AV:N/AC:L/PR:N/UI:N/S:U/C:H/I:N/A:N,"The mkdocs 1.2.2 built-in dev-server allows directory traversal using the port 8000, enabling remote exploitation to obtain :sensitive information. NOTE: the vendor has disputed this as described in https://github.com/mkdocs/mkdocs/issues/2601.] and https://github.com/nisdn/CVE-2021-40978/issues/1",2021-10-07T14:15:00Z,0
pyspark,pypi,GHSA-9rr6-jpg7-9jg6,CVSS_V3,CVSS:3.1/AV:N/AC:L/PR:N/UI:N/S:U/C:H/I:N/A:N,Authentication Bypass by Capture-replay in Apache Spark,2022-03-11T00:02:36Z,0
langchain,pypi,GHSA-6h8p-4hx9-w66c,CVSS_V3,CVSS:3.1/AV:N/AC:L/PR:N/UI:N/S:U/C:H/I:N/A:N,Langchain Server-Side Request Forgery vulnerability,2023-10-21T00:30:47Z,0
langchain,pypi,GHSA-7q94-qpjr-xpgm,CVSS_V3,CVSS:3.1/AV:N/AC:L/PR:N/UI:N/S:U/C:H/I:N/A:N,langchain SQL Injection vulnerability,2023-07-06T15:30:33Z,0
django,pypi,GHSA-89hj-xfx5-7q66,CVSS_V3,CVSS:3.1/AV:N/AC:L/PR:N/UI:N/S:U/C:H/I:N/A:N,Django Reuses Cached CSRF Token,2022-05-17T03:07:04Z,0
django,pypi,GHSA-8c5j-9r9f-c6w8,CVSS_V3,CVSS:3.1/AV:N/AC:L/PR:N/UI:N/S:U/C:H/I:N/A:N,Information disclosure in Django,2022-01-12T19:21:10Z,0
django,pypi,GHSA-9jmf-237g-qf46,CVSS_V3,CVSS:3.1/AV:N/AC:L/PR:N/UI:N/S:U/C:H/I:N/A:N,Django Path Traversal vulnerability,2024-07-10T06:33:52Z,0
django,pypi,GHSA-9xg7-gg9m-rmq9,CVSS_V3,CVSS:3.1/AV:N/AC:L/PR:N/UI:N/S:U/C:H/I:N/A:N,Django Admin Media Handler Vulnerable to Directory Traversal,2022-05-02T03:37:17Z,0
django,pypi,GHSA-fr28-569j-53c4,CVSS_V3,CVSS:3.1/AV:N/AC:L/PR:N/UI:N/S:U/C:H/I:N/A:N,Django Incorrect Default Permissions,2021-03-18T20:30:01Z,0
django,pypi,GHSA-m6gj-h9gm-gw44,CVSS_V3,CVSS:3.1/AV:N/AC:L/PR:N/UI:N/S:U/C:H/I:N/A:N,Django Incorrect Default Permissions,2021-03-18T20:30:13Z,0
django,pypi,GHSA-rxjp-mfm9-w4wr,CVSS_V3,CVSS:3.1/AV:N/AC:L/PR:N/UI:N/S:U/C:H/I:N/A:N,Path Traversal in Django,2021-06-04T21:15:56Z,0
pymdown-extensions,pypi,GHSA-jh85-wwv9-24hv,CVSS_V3,CVSS:3.1/AV:N/AC:L/PR:N/UI:N/S:U/C:H/I:N/A:N,Any file can be included with the pymdown-snippets extension,2023-05-15T20:50:23Z,0
flask-cors,pypi,GHSA-hxwh-jpp2-84pm,CVSS_V3,CVSS:3.1/AV:N/AC:L/PR:N/UI:N/S:U/C:H/I:N/A:N,Flask-CORS allows the `Access-Control-Allow-Private-Network` CORS header to be set to true by default,2024-08-18T21:31:07Z,0
flask-cors,pypi,GHSA-xc3p-ff3m-f46v,CVSS_V3,CVSS:3.1/AV:N/AC:L/PR:N/UI:N/S:U/C:H/I:N/A:N,Flask-Cors Directory Traversal vulnerability,2021-05-06T18:51:48Z,0
flask-cors,pypi,PYSEC-2024-71,CVSS_V3,CVSS:3.1/AV:N/AC:L/PR:N/UI:N/S:U/C:H/I:N/A:N,"A vulnerability in corydolphin/flask-cors up to version 4.0.1 allows the `Access-Control-Allow-Private-Network` CORS header to be set to true by default, without any configuration option. This behavior can expose private network resources to unauthorized external access, leading to significant security risks such as data breaches, unauthorized access to sensitive information, and potential network intrusions.",2024-08-18T19:15:00Z,0
cherrypy,pypi,GHSA-76x8-gg39-5jjg,CVSS_V3,CVSS:3.1/AV:N/AC:L/PR:N/UI:N/S:U/C:H/I:N/A:N,CherryPy Malicious cookies allow access to files outside the session directory,2022-05-01T23:28:42Z,0
cherrypy,pypi,GHSA-vx77-5pf4-c9wr,CVSS_V3,CVSS:3.1/AV:N/AC:L/PR:N/UI:N/S:U/C:H/I:N/A:N,CherryPy Directory traversal vulnerability,2022-05-01T06:43:18Z,0
Twisted,pypi,GHSA-92x2-jw7w-xvvx,CVSS_V3,CVSS:3.1/AV:N/AC:L/PR:N/UI:N/S:U/C:H/I:N/A:N,Cookie and header exposure in twisted,2022-02-07T22:36:00Z,0
couchbase,pypi,PYSEC-2023-235,CVSS_V3,CVSS:3.1/AV:N/AC:L/PR:N/UI:N/S:U/C:H/I:N/A:N,An issue was discovered in Couchbase Server 7.2.0. There is a private key leak in debug.log while adding a pre-7.0 node to a 7.2 cluster.,2023-11-08T21:15:00Z,0
paddlepaddle,pypi,GHSA-2hvc-hwg3-hpvw,CVSS_V3,CVSS:3.1/AV:N/AC:L/PR:N/UI:N/S:U/C:H/I:N/A:H,PaddlePaddle Out-of-bounds Read vulnerability,2022-12-07T09:30:23Z,0
onnx,pypi,PYSEC-2024-223,CVSS_V3,CVSS:3.1/AV:N/AC:L/PR:N/UI:N/S:U/C:H/I:N/A:H,"Versions of the package onnx before and including 1.15.0 are vulnerable to Out-of-bounds Read as the ONNX_ASSERT and ONNX_ASSERTM functions have an off by one string copy.
",2024-02-23T18:15:50Z,0
starlite,pypi,GHSA-83pv-qr33-2vcf,CVSS_V3,CVSS:3.1/AV:N/AC:L/PR:N/UI:N/S:U/C:H/I:L/A:N,Litestar and Starlite vulnerable to Path Traversal,2024-05-06T14:20:50Z,0
py7zr,pypi,GHSA-m8xw-9x5x-6vh3,CVSS_V3,CVSS:3.1/AV:N/AC:L/PR:N/UI:N/S:U/C:H/I:H/A:N,py7zr directory traversal vulnerability,2022-12-06T21:30:45Z,0
ecdsa,pypi,GHSA-8qxj-f9rh-9fg2,CVSS_V3,CVSS:3.1/AV:N/AC:L/PR:N/UI:N/S:U/C:H/I:H/A:N,Improper Verification of Cryptographic Signature in Pure-Python ECDSA,2020-04-01T16:35:26Z,0
waitress,pypi,GHSA-9298-4cf8-g4wj,CVSS_V3,CVSS:3.1/AV:N/AC:L/PR:N/UI:N/S:U/C:H/I:H/A:N,Waitress has request processing race condition in HTTP pipelining with invalid first request,2024-10-29T14:45:03Z,0
django,pypi,GHSA-7g9h-c88w-r7h2,CVSS_V3,CVSS:3.1/AV:N/AC:L/PR:N/UI:N/S:U/C:H/I:H/A:N,Directory traversal in Django,2018-07-23T19:52:31Z,0
django,pypi,GHSA-pv4p-cwwg-4rph,CVSS_V3,CVSS:3.1/AV:N/AC:L/PR:N/UI:N/S:U/C:H/I:H/A:N,Django SQL injection vulnerability,2024-08-07T15:30:42Z,0
eslint-scope,npm,GHSA-hxxf-q3w9-4xgw,CVSS_V3,CVSS:3.1/AV:N/AC:L/PR:N/UI:N/S:U/C:H/I:H/A:N,Malicious Package in eslint-scope,2018-07-12T19:52:02Z,0
node-forge,npm,GHSA-92xj-mqp7-vmcj,CVSS_V3,CVSS:3.1/AV:N/AC:L/PR:N/UI:N/S:U/C:H/I:H/A:H/E:P/RL:O/RC:C,Prototype Pollution in node-forge,2020-09-14T21:42:09Z,0
gitpython,pypi,GHSA-pr76-5cm5-w9cj,CVSS_V3,CVSS:3.1/AV:N/AC:L/PR:N/UI:N/S:U/C:H/I:H/A:H,GitPython vulnerable to remote code execution due to insufficient sanitization of input arguments,2023-08-11T09:30:36Z,0
lmdb,pypi,GHSA-9q62-r72g-pvv7,CVSS_V3,CVSS:3.1/AV:N/AC:L/PR:N/UI:N/S:U/C:H/I:H/A:H,py-lmdb Invalid write operation,2022-05-24T16:55:55Z,0
lmdb,pypi,GHSA-c74c-p4p7-r8q5,CVSS_V3,CVSS:3.1/AV:N/AC:L/PR:N/UI:N/S:U/C:H/I:H/A:H,py-lmdb Invalid write operation,2022-05-24T16:55:55Z,0
lmdb,pypi,GHSA-pf3p-v9xp-mrvf,CVSS_V3,CVSS:3.1/AV:N/AC:L/PR:N/UI:N/S:U/C:H/I:H/A:H,py-lmdb Invalid write operation,2022-05-24T22:00:30Z,0
paddlepaddle,pypi,GHSA-83g7-8fch-p37m,CVSS_V3,CVSS:3.1/AV:N/AC:L/PR:N/UI:N/S:U/C:H/I:H/A:H,PaddlePaddle vulnerable to code injection via winstr,2022-11-26T03:30:27Z,0
paddlepaddle,pypi,GHSA-gcjf-29m9-888q,CVSS_V3,CVSS:3.1/AV:N/AC:L/PR:N/UI:N/S:U/C:H/I:H/A:H,PaddlePaddle vulnerable to Code Injection,2022-12-07T09:30:23Z,0
paddlepaddle,pypi,GHSA-mrmm-qmrj-xgp6,CVSS_V3,CVSS:3.1/AV:N/AC:L/PR:N/UI:N/S:U/C:H/I:H/A:H,PaddlePaddle vulnerable to remote code execution,2024-03-07T09:30:33Z,0
paddlepaddle,pypi,PYSEC-2022-43063,CVSS_V3,CVSS:3.1/AV:N/AC:L/PR:N/UI:N/S:U/C:H/I:H/A:H,"Code injection in paddle.audio.functional.get_window in PaddlePaddle 2.4.0-rc0 allows arbitrary code execution.
",2022-12-07T09:15:00Z,0
paddlepaddle,pypi,PYSEC-2024-136,CVSS_V3,CVSS:3.1/AV:N/AC:L/PR:N/UI:N/S:U/C:H/I:H/A:H,"Stack overflow in paddle.searchsorted in PaddlePaddle before 2.6.0. This flaw can lead to a denial of service, or even more damage.



",2024-01-03T09:15:00Z,0
paddlepaddle,pypi,PYSEC-2024-139,CVSS_V3,CVSS:3.1/AV:N/AC:L/PR:N/UI:N/S:U/C:H/I:H/A:H,"Stack overflow in paddle.linalg.lu_unpack in PaddlePaddle before 2.6.0. This flaw can lead to a denial of service, or even more damage.



",2024-01-03T09:15:00Z,0
paddlepaddle,pypi,PYSEC-2024-141,CVSS_V3,CVSS:3.1/AV:N/AC:L/PR:N/UI:N/S:U/C:H/I:H/A:H,"Heap buffer overflow in paddle.repeat_interleave in PaddlePaddle before 2.6.0. This flaw can lead to a denial of service, information disclosure, or more damage is possible.



",2024-01-03T09:15:00Z,0
paddlepaddle,pypi,PYSEC-2024-142,CVSS_V3,CVSS:3.1/AV:N/AC:L/PR:N/UI:N/S:U/C:H/I:H/A:H,"PaddlePaddle before 2.6.0 has a command injection in get_online_pass_interval. This resulted in the ability to execute arbitrary commands on the operating system.







",2024-01-03T09:15:00Z,0
paddlepaddle,pypi,PYSEC-2024-143,CVSS_V3,CVSS:3.1/AV:N/AC:L/PR:N/UI:N/S:U/C:H/I:H/A:H,"PaddlePaddle before 2.6.0 has a command injection in _wget_download. This resulted in the ability to execute arbitrary commands on the operating system.







",2024-01-03T09:15:00Z,0
paddlepaddle,pypi,PYSEC-2024-146,CVSS_V3,CVSS:3.1/AV:N/AC:L/PR:N/UI:N/S:U/C:H/I:H/A:H,"PaddlePaddle before 2.6.0 has a command injection in convert_shape_compare. This resulted in the ability to execute arbitrary commands on the operating system.







",2024-01-03T09:15:00Z,0
twisted,pypi,GHSA-h96w-mmrf-2h6v,CVSS_V3,CVSS:3.1/AV:N/AC:L/PR:N/UI:N/S:U/C:H/I:H/A:H,Improper Input Validation in Twisted,2020-03-31T15:42:42Z,0
twisted,pypi,GHSA-p5xh-vx83-mxcj,CVSS_V3,CVSS:3.1/AV:N/AC:L/PR:N/UI:N/S:U/C:H/I:H/A:H,HTTP Request Smuggling in Twisted,2020-03-31T15:40:12Z,0
vllm,pypi,GHSA-ggpf-24jw-3fcw,CVSS_V3,CVSS:3.1/AV:N/AC:L/PR:N/UI:N/S:U/C:H/I:H/A:H,CVE-2025-24357 Malicious model remote code execution fix bypass with PyTorch < 2.6.0,2025-04-23T02:26:06Z,0
vllm,pypi,GHSA-hjq4-87xh-g4fv,CVSS_V3,CVSS:3.1/AV:N/AC:L/PR:N/UI:N/S:U/C:H/I:H/A:H,vLLM Allows Remote Code Execution via PyNcclPipe Communication Service,2025-05-20T18:04:30Z,0
vllm,pypi,PYSEC-2025-42,CVSS_V3,CVSS:3.1/AV:N/AC:L/PR:N/UI:N/S:U/C:H/I:H/A:H,"vLLM is a high-throughput and memory-efficient inference and serving engine for LLMs. Versions starting from 0.6.5 and prior to 0.8.5, having vLLM integration with mooncake, are vulnerable to remote code execution due to using pickle based serialization over unsecured ZeroMQ sockets. The vulnerable sockets were set to listen on all network interfaces, increasing the likelihood that an attacker is able to reach the vulnerable ZeroMQ sockets to carry out an attack. vLLM instances that do not make use of the mooncake integration are not vulnerable. This issue has been patched in version 0.8.5.",2025-04-30T01:15:51Z,0
jsonpickle,pypi,GHSA-j66q-qmrc-89rx,CVSS_V3,CVSS:3.1/AV:N/AC:L/PR:N/UI:N/S:U/C:H/I:H/A:H,jsonpickle unsafe deserialization,2022-05-24T17:36:44Z,0
pyspark,pypi,GHSA-wgx7-jwwm-cgjv,CVSS_V3,CVSS:3.1/AV:N/AC:L/PR:N/UI:N/S:U/C:H/I:H/A:H,Improper Authentication in Apache Spark,2022-02-10T23:05:20Z,0
llama-index,pypi,GHSA-2jxw-4hm4-6w87,CVSS_V3,CVSS:3.1/AV:N/AC:L/PR:N/UI:N/S:U/C:H/I:H/A:H,SQL injection in llama-index,2024-01-22T03:30:26Z,0
llama-index,pypi,GHSA-2xxc-73fv-36f7,CVSS_V3,CVSS:3.1/AV:N/AC:L/PR:N/UI:N/S:U/C:H/I:H/A:H,llama-index vulnerable to arbitrary code execution,2023-08-15T18:31:32Z,0
llama-index,pypi,PYSEC-2023-148,CVSS_V3,CVSS:3.1/AV:N/AC:L/PR:N/UI:N/S:U/C:H/I:H/A:H,An issue in llama_index v.0.7.13 and before allows a remote attacker to execute arbitrary code via the `exec` parameter in PandasQueryEngine function.,2023-08-15T17:15:00Z,0
bottle,pypi,GHSA-873q-wpqr-xfgw,CVSS_V3,CVSS:3.1/AV:N/AC:L/PR:N/UI:N/S:U/C:H/I:H/A:H,Bottle does not properly limit content-types,2022-05-17T04:19:29Z,0
bottle,pypi,GHSA-xhp9-4947-rq78,CVSS_V3,CVSS:3.1/AV:N/AC:L/PR:N/UI:N/S:U/C:H/I:H/A:H,Denial of service in bottle,2022-06-03T00:01:15Z,0
langchain,pypi,GHSA-2qmj-7962-cjq8,CVSS_V3,CVSS:3.1/AV:N/AC:L/PR:N/UI:N/S:U/C:H/I:H/A:H,langchain arbitrary code execution vulnerability,2023-07-03T21:30:57Z,0
langchain,pypi,GHSA-57fc-8q82-gfp3,CVSS_V3,CVSS:3.1/AV:N/AC:L/PR:N/UI:N/S:U/C:H/I:H/A:H,langchain vulnerable to arbitrary code execution,2023-07-06T15:30:33Z,0
langchain,pypi,GHSA-6643-h7h5-x9wh,CVSS_V3,CVSS:3.1/AV:N/AC:L/PR:N/UI:N/S:U/C:H/I:H/A:H,Langchain vulnerable to arbitrary code execution,2023-06-20T15:31:09Z,0
langchain,pypi,GHSA-7gfq-f96f-g85j,CVSS_V3,CVSS:3.1/AV:N/AC:L/PR:N/UI:N/S:U/C:H/I:H/A:H,langchain vulnerable to arbitrary code execution,2023-08-22T21:30:27Z,0
langchain,pypi,GHSA-8h5w-f6q9-wg35,CVSS_V3,CVSS:3.1/AV:N/AC:L/PR:N/UI:N/S:U/C:H/I:H/A:H,Langchain SQL Injection vulnerability,2023-10-21T00:30:47Z,0
langchain,pypi,GHSA-92j5-3459-qgp4,CVSS_V3,CVSS:3.1/AV:N/AC:L/PR:N/UI:N/S:U/C:H/I:H/A:H,LangChain vulnerable to arbitrary code execution,2023-08-15T18:31:32Z,0
langchain,pypi,GHSA-f73w-4m7g-ch9x,CVSS_V3,CVSS:3.1/AV:N/AC:L/PR:N/UI:N/S:U/C:H/I:H/A:H,Langchain vulnerable to arbitrary code execution via the evaluate function in the numexpr library,2023-09-01T18:30:41Z,0
langchain,pypi,GHSA-fj32-q626-pjjc,CVSS_V3,CVSS:3.1/AV:N/AC:L/PR:N/UI:N/S:U/C:H/I:H/A:H,LangChain vulnerable to arbitrary code execution,2023-08-15T18:31:32Z,0
langchain,pypi,GHSA-fprp-p869-w6q2,CVSS_V3,CVSS:3.1/AV:N/AC:L/PR:N/UI:N/S:U/C:H/I:H/A:H,LangChain vulnerable to code injection,2023-04-05T03:30:17Z,0
langchain,pypi,GHSA-gwqq-6vq7-5j86,CVSS_V3,CVSS:3.1/AV:N/AC:L/PR:N/UI:N/S:U/C:H/I:H/A:H,langchain Code Injection vulnerability,2023-08-05T03:30:19Z,0
langchain,pypi,GHSA-prgp-w7vf-ch62,CVSS_V3,CVSS:3.1/AV:N/AC:L/PR:N/UI:N/S:U/C:H/I:H/A:H,LangChain vulnerable to arbitrary code execution,2023-08-15T18:31:32Z,0
langchain,pypi,GHSA-x32c-59v5-h7fg,CVSS_V3,CVSS:3.1/AV:N/AC:L/PR:N/UI:N/S:U/C:H/I:H/A:H,Langchain OS Command Injection vulnerability,2023-06-14T15:30:39Z,0
langchain,pypi,PYSEC-2023-138,CVSS_V3,CVSS:3.1/AV:N/AC:L/PR:N/UI:N/S:U/C:H/I:H/A:H,"An issue in Harrison Chase langchain v.0.0.194 allows an attacker to execute arbitrary code via the python exec calls in the PALChain, affected functions include from_math_prompt and from_colored_object_prompt.",2023-08-05T03:15:00Z,0
langchain,pypi,PYSEC-2023-145,CVSS_V3,CVSS:3.1/AV:N/AC:L/PR:N/UI:N/S:U/C:H/I:H/A:H,An issue in LangChain v.0.0.231 allows a remote attacker to execute arbitrary code via the prompt parameter.,2023-08-15T17:15:00Z,0
